{
  "id": "biology_7a_rjb_cpt10",
  "method": "con2fable-multi-agent",
  "concept": {
    "name": "遗传和变异",
    "aliases": [],
    "forbidden_terms": [
      "遗传和变异"
    ]
  },
  "mechanism_graph": {
    "nodes": [
      {
        "id": "n1",
        "text": "子代与亲代在很多方面表现出相同特征（遗传），但总有一部分特征不相同（变异）的现象。",
        "weight": 0.85,
        "source": "definition"
      },
      {
        "id": "n2",
        "text": "属于或连接到上位结构：生物的共同特征",
        "weight": 0.85,
        "source": "definition"
      }
    ],
    "edges": [
      {
        "id": "e1",
        "source": "n1",
        "target": "n2",
        "relation": "leads_to",
        "weight": 1.0,
        "source_edge_id": "normalized:edge:10771"
      }
    ]
  },
  "output": {
    "narrative": "年轻园丁第一天到园圃值守所报到，老园丁指给他一片月季花丛：“这些月季就归你照看了。”\n\n他弯下腰，仔细查看那丛月季的母株。母株粗壮，开出的花是深红色的，花瓣层层叠叠，非常好看。他掏出记录本，把母株的样子画了下来。没过多久，母株根部冒出几根新枝，他每天浇水、松土，看着新枝一天天长高。\n\n春天来了，新枝上的花苞一个个绽开。年轻园丁凑近一看，愣住了——有几枝新枝开出的花和母株一模一样，也是深红色、重瓣的。可另外两枝却完全不同：一枝开出粉色的单瓣花，另一枝的花瓣边缘竟然镶着一圈白边。他揉了揉眼睛，又蹲下来仔细对比，土壤是一样的，水分和阳光也都一样。\n\n“这怎么可能呢？”他自言自语。\n\n他跑去问老园丁，老园丁正在修剪枝条，头也不抬地说：“别急，你继续看，把每一枝开的花都记下来。”\n\n年轻园丁耐着性子，每天在记录本上画下每一朵花的样子。一个月过去，花期快结束了，他翻看记录本，发现一个规律：大多数新枝开的花都和母株差不多，可每一批新枝里，总会冒出几朵不一样的。有的花瓣少两片，有的颜色淡一些，还有的花心里多了几根细丝。\n\n他又去找老园丁。老园丁接过记录本，翻了几页，指着那些画说：“你看，这些新枝都从同一棵母株长出来，它们带着母株的底子，可每一枝又都有自己的模样。这不是乱，这是它们的本性。”\n\n年轻园丁看着记录本上那些相似又不同的花，忽然明白了。他不再追问为什么会有不同，而是拿起笔，在记录本上认真地写下每一枝新花的特征。他知道，明年春天，这些新枝还会再长，还会开出既有相同又有不同的花来。",
    "node_alignments": [
      {
        "concept_node_id": "n1",
        "narrative_element": "月季新枝与母株的相似与差异现象",
        "evidence": "有几枝新枝开出的花和母株一模一样，也是深红色、重瓣的。可另外两枝却完全不同：一枝开出粉色的单瓣花，另一枝的花瓣边缘竟然镶着一圈白边",
        "narrative_anchor": "有几枝新枝开出的花和母株一模一样，也是深红色、重瓣的。可另外两枝却完全不同：一枝开出粉色的单瓣花，另一枝的花瓣边缘竟然镶着一圈白边",
        "confidence": 0.95
      },
      {
        "concept_node_id": "n2",
        "narrative_element": "年轻园丁认识到月季的相似与差异是生物共同特征",
        "evidence": "这些新枝都从同一棵母株长出来，它们带着母株的底子，可每一枝又都有自己的模样。这不是乱，这是它们的本性",
        "narrative_anchor": "这些新枝都从同一棵母株长出来，它们带着母株的底子，可每一枝又都有自己的模样。这不是乱，这是它们的本性",
        "confidence": 0.9
      }
    ],
    "edge_alignments": [
      {
        "concept_edge_id": "e1",
        "narrative_relation": "月季新枝的相似与差异现象（n1）被年轻园丁认识到是生物共同特征（n2）",
        "evidence": "这些新枝都从同一棵母株长出来，它们带着母株的底子，可每一枝又都有自己的模样。这不是乱，这是它们的本性",
        "narrative_anchor": "这些新枝都从同一棵母株长出来，它们带着母株的底子，可每一枝又都有自己的模样。这不是乱，这是它们的本性",
        "narrative_source_concept_node_id": "n1",
        "narrative_target_concept_node_id": "n2",
        "direction_preserved": true,
        "confidence": 0.9
      }
    ]
  }
}