{
  "id": "biology_7a_rjb_cpt10",
  "method": "con2fable-multi-agent",
  "concept": {
    "name": "遗传和变异",
    "aliases": [],
    "forbidden_terms": [
      "遗传和变异"
    ]
  },
  "mechanism_graph": {
    "nodes": [
      {
        "id": "n1",
        "text": "子代与亲代在很多方面表现出相同特征（遗传），但总有一部分特征不相同（变异）的现象。",
        "weight": 0.85,
        "source": "definition"
      }
    ],
    "edges": []
  },
  "output": {
    "narrative": "老园丁带着年轻园丁巡视园圃，走到一片月季区时停下了脚步。\n\n“你看这株，”老园丁指着一株开得正盛的月季，“去年我从那棵母株上压条繁殖的。”年轻园丁凑近细看，花瓣层层叠叠，颜色是沉稳的深红，与旁边那棵母株的花朵几乎分毫不差。他点点头，心里觉得理所当然。\n\n老园丁又指向另一株月季：“这也是从同一棵母株上压条繁殖的。”年轻园丁走过去，观察了片刻，却皱起了眉。这株月季的花瓣颜色比母株浅了许多，透出淡淡的粉，而且花瓣边缘带着细微的锯齿状，不像母株那样圆润光滑。他蹲下身，反复比较了两株花的形状和色泽，越看越觉得不对劲。\n\n“怎么会不一样呢？”年轻园丁站起来，满脸困惑，“明明是同一棵母株繁殖出来的，一株和母株一模一样，另一株却差这么多，是不是哪里弄错了？”\n\n老园丁没有回答，只是从怀里掏出一本旧记录本，翻到去年的繁殖记录页。上面工整地写着两株月季的母株来源和繁殖日期，还附有母株特征的描述：深红花、圆瓣。年轻园丁接过记录本，对照着眼前的月季看了一遍。第一株月季与记录上的描述完全吻合，而第二株月季——颜色浅、花瓣带锯齿——与记录上的描述有多处出入。\n\n他盯着记录本，又看看那株与众不同的月季，忽然明白了：记录本没有错，母株也没有错，差异就那样自然地存在着，从同一源头来的后代，并不是每一株都必须完全相同。\n\n年轻园丁不再困惑，他取出笔，在记录本上认真补上了第二株月季的细节：浅粉、花瓣边缘锯齿状。然后他在旁边标注——特殊观察对象。",
    "node_alignments": [
      {
        "concept_node_id": "n1",
        "narrative_element": "子代与亲代在很多方面表现出相同特征（遗传），但总有一部分特征不相同（变异）的现象。",
        "evidence": "第一株月季与记录上的描述完全吻合，而第二株月季——颜色浅、花瓣带锯齿——与记录上的描述有多处出入",
        "narrative_anchor": "第一株月季与记录上的描述完全吻合，而第二株月季——颜色浅、花瓣带锯齿——与记录上的描述有多处出入",
        "confidence": 0.95
      }
    ],
    "edge_alignments": []
  }
}