{
  "id": "chemistry_9a_rjb_cpt100",
  "method": "con2fable-multi-agent",
  "concept": {
    "name": "缓慢氧化",
    "aliases": [],
    "forbidden_terms": [
      "缓慢氧化"
    ]
  },
  "mechanism_graph": {
    "nodes": [
      {
        "id": "n1",
        "text": "进行得很慢、甚至不容易被察觉的氧化反应，仍属于氧化反应但没有显著的发光发热现象。",
        "weight": 1.0,
        "source": "core_mechanism_zh"
      },
      {
        "id": "n2",
        "text": "区分化学反应和物理混合。",
        "weight": 0.85,
        "source": "must_preserve_zh"
      },
      {
        "id": "n3",
        "text": "保留守恒关系和反应前后变化。",
        "weight": 0.85,
        "source": "must_preserve_zh"
      }
    ],
    "edges": [
      {
        "id": "e1",
        "source": "n1",
        "target": "n2",
        "relation": "leads_to",
        "weight": 1.0,
        "kg_relation": "prerequisites_for",
        "source_edge_id": "normalized:edge:15248",
        "source_name": "氧化反应",
        "target_name": "缓慢氧化",
        "relation_semantic_role": "prerequisite"
      },
      {
        "id": "e2",
        "source": "n2",
        "target": "n3",
        "relation": "leads_to",
        "weight": 1.0,
        "kg_relation": "relates_to",
        "source_edge_id": "normalized:edge:18223",
        "source_name": "呼吸与氧气",
        "target_name": "缓慢氧化",
        "relation_semantic_role": "association"
      }
    ]
  },
  "output": {
    "narrative": "账房仓库的调度员阿成新领到一批封存箱，按登记规则，他必须先核对入口处的前置条件牌——牌上写明箱内物品是否属于可缓慢起变化的种类。阿成看了一眼，牌上写的是“铁器类”，便觉得没问题，跳过核对直接让验收员封箱。\n\n验收员老周翻开分段记录册，发现入口条件那一栏是空的，便不肯盖章。“没有前置核对，后面的登记不能开始。”阿成不耐烦，说：“铁器还能变什么？直接推进第二道转化环节不就行了？”他强行把箱子转到下一流程，让记录员填写转化记录。\n\n记录员小陈同时拿出两份相关记录——一份是入库时的物品清单，一份是仓库湿度日志。他把两份放在一起比较，发现铁器在潮湿环境里会慢慢起变化，虽然不发光发热，但重量和形态都会改变。小陈对阿成说：“这两份记录共同约束最后的判断，缺一个都不行。”\n\n阿成不信，三天后打开封存箱检查，发现铁器表面已经生出一层暗红色的锈迹，而封箱前的登记里完全没有记录这个变化。调度员这才明白，先稳定入口条件核对，再推动第二道转化环节，前后两步必须互相承接；倒过来安排，后面的验收根本接不上。\n\n最后，阿成重新按顺序操作：先确认前置条件牌上的内容，再按守恒规则登记转化过程，老周用结果验收记录核对整条安排，三份记录终于能够互相印证。",
    "node_alignments": [
      {
        "concept_node_id": "n1",
        "narrative_element": "入口条件核对",
        "evidence": "前置条件牌",
        "narrative_anchor": "前置条件牌",
        "confidence": 0.95
      },
      {
        "concept_node_id": "n2",
        "narrative_element": "第二道转化环节",
        "evidence": "第二道转化环节",
        "narrative_anchor": "第二道转化环节",
        "confidence": 0.9
      },
      {
        "concept_node_id": "n3",
        "narrative_element": "结果验收记录",
        "evidence": "结果验收记录",
        "narrative_anchor": "结果验收记录",
        "confidence": 0.9
      }
    ],
    "edge_alignments": [
      {
        "concept_edge_id": "e1",
        "narrative_relation": "先稳定入口条件核对，再推动第二道转化环节",
        "evidence": "先稳定入口条件核对，再推动第二道转化环节",
        "narrative_anchor": "先稳定入口条件核对，再推动第二道转化环节",
        "narrative_source_concept_node_id": "n1",
        "narrative_target_concept_node_id": "n2",
        "direction_preserved": true,
        "confidence": 0.95
      },
      {
        "concept_edge_id": "e2",
        "narrative_relation": "两份相关记录共同约束最后判断",
        "evidence": "验收员老周翻开分段记录册，发现入口条件那一栏是空的，便不肯盖章。",
        "narrative_anchor": "验收员老周翻开分段记录册，发现入口条件那一栏是空的，便不肯盖章。",
        "narrative_source_concept_node_id": "n2",
        "narrative_target_concept_node_id": "n3",
        "direction_preserved": true,
        "confidence": 0.9
      }
    ]
  }
}