{
  "id": "biology_7a_rjb_cpt101",
  "method": "con2fable-multi-agent",
  "concept": {
    "name": "种子萌发",
    "aliases": [],
    "forbidden_terms": [
      "种子萌发"
    ]
  },
  "mechanism_graph": {
    "nodes": [
      {
        "id": "n1",
        "text": "种子在适宜条件下吸水并利用贮藏营养，使胚根、胚芽等开始发育，最终长成幼苗的过程。",
        "weight": 0.85,
        "source": "definition"
      }
    ],
    "edges": []
  },
  "output": {
    "narrative": "老周和小陆在园圃值守所值班，检查培养箱里的休眠种球。小陆摸了摸种球外壳，皱起眉头：“外壳干成这样，得赶紧大量浇水，不然怕是要废了。”\n\n老周摆摆手，没有急着同意。他拿起记录仪，先测了培养箱的温度和湿度，又用小工具轻轻刮开一粒种球的外壳，仔细查看内部。“外壳干不假，但内部胚体还完好，没有虫害，只是环境条件不对。”老周说着，指了指记录仪上的数据，“温度偏低，湿度也不够，可盲目浇水反而会泡坏胚体。”\n\n小陆凑过来看，有些不服气：“那怎么办？总不能干等着。”\n\n老周没有多解释，只是调整了灌溉系统，先给培养箱少量供水，让种球外壳慢慢湿润，同时把温度缓缓升高。小陆半信半疑，但还是把操作记在了值班日志里。\n\n头两天没什么变化。第三天，小陆发现种球外壳开始变软，凑近看，隐约能感到内部有细微的动静。他喊老周来看，老周点点头：“条件对了，它自己就会动。”\n\n又过了几天，种球外壳裂开一道缝，幼嫩的胚根和胚芽伸了出来，稳稳地扎进培养土中。小陆蹲在培养箱前看了很久，终于明白：让种球启动生长的，不是硬灌多少水，而是温度和水分恰到好处，再加上胚体本身完好。三者缺一不可。",
    "node_alignments": [
      {
        "concept_node_id": "n1",
        "narrative_element": "休眠种球在适宜的温度、水分和内部胚体完好的条件下，外壳吸水变软，胚根和胚芽开始发育，最终长成幼苗的过程。",
        "evidence": "种球外壳裂开一道缝，幼嫩的胚根和胚芽伸了出来",
        "narrative_anchor": "种球外壳裂开一道缝，幼嫩的胚根和胚芽伸了出来",
        "confidence": 0.95
      }
    ],
    "edge_alignments": []
  }
}